{
  "version": 2.0,
  "success": true,
  "reason": null,
  "content": {
    "traffic_flows": [
      {
        "src": {
          "ip": "176.9.150.138",
          "ip_lists": [
            {
              "href": "/orgs/28/sec_policy/draft/ip_lists/2191",
              "name": "Internet"
            }
          ]
        },
        "dst": {
          "ip": "10.1.100.149",
          "workload": {
            "href": "/orgs/28/workloads/7c78ab4b-ced8-43a7-bf1f-5e92f89138bf",
            "hostname": "windows-jumpbox-1",
            "os_type": "windows",
            "labels": [
              {
                "href": "/orgs/28/labels/21494",
                "key": "app",
                "value": "Administration"
              },
              {
                "href": "/orgs/28/labels/21480",
                "key": "env",
                "value": "Production"
              },
              {
                "href": "/orgs/28/labels/21481",
                "key": "loc",
                "value": "Dallas"
              },
              {
                "href": "/orgs/28/labels/21495",
                "key": "role",
                "value": "Jump Server"
              }
            ]
          }
        },
        "service": {
          "port": 3389,
          "proto": 6,
          "process_name": "svchost.exe",
          "windows_service_name": "TermService",
          "user_name": "NETWORK SERVICE"
        },
        "num_connections": 1,
        "state": "timed out",
        "timestamp_range": {
          "first_detected": "2022-02-03T22:33:52Z",
          "last_detected": "2022-02-03T22:33:52Z"
        },
        "dst_bi": 0,
        "dst_bo": 0,
        "policy_decision": "potentially_blocked",
        "flow_direction": "inbound"
      },
      {
        "src": {
          "ip": "20.107.24.45",
          "ip_lists": [
            {
              "href": "/orgs/28/sec_policy/draft/ip_lists/2191",
              "name": "Internet"
            }
          ]
        },
        "dst": {
          "ip": "10.1.100.149",
          "workload": {
            "href": "/orgs/28/workloads/7c78ab4b-ced8-43a7-bf1f-5e92f89138bf",
            "hostname": "windows-jumpbox-1",
            "os_type": "windows",
            "labels": [
              {
                "href": "/orgs/28/labels/21494",
                "key": "app",
                "value": "Administration"
              },
              {
                "href": "/orgs/28/labels/21480",
                "key": "env",
                "value": "Production"
              },
              {
                "href": "/orgs/28/labels/21481",
                "key": "loc",
                "value": "Dallas"
              },
              {
                "href": "/orgs/28/labels/21495",
                "key": "role",
                "value": "Jump Server"
              }
            ]
          }
        },
        "service": {
          "port": 3389,
          "proto": 6,
          "process_name": "svchost.exe",
          "windows_service_name": "TermService",
          "user_name": "NETWORK SERVICE"
        },
        "num_connections": 1,
        "state": "timed out",
        "timestamp_range": {
          "first_detected": "2022-02-03T22:33:53Z",
          "last_detected": "2022-02-03T22:33:53Z"
        },
        "dst_bi": 0,
        "dst_bo": 0,
        "policy_decision": "potentially_blocked",
        "flow_direction": "inbound"
      },
      {
        "src": {
          "ip": "193.56.146.208",
          "ip_lists": [
            {
              "href": "/orgs/28/sec_policy/draft/ip_lists/2191",
              "name": "Internet"
            }
          ]
        },
        "dst": {
          "ip": "10.1.100.149",
          "workload": {
            "href": "/orgs/28/workloads/7c78ab4b-ced8-43a7-bf1f-5e92f89138bf",
            "hostname": "windows-jumpbox-1",
            "os_type": "windows",
            "labels": [
              {
                "href": "/orgs/28/labels/21494",
                "key": "app",
                "value": "Administration"
              },
              {
                "href": "/orgs/28/labels/21480",
                "key": "env",
                "value": "Production"
              },
              {
                "href": "/orgs/28/labels/21481",
                "key": "loc",
                "value": "Dallas"
              },
              {
                "href": "/orgs/28/labels/21495",
                "key": "role",
                "value": "Jump Server"
              }
            ]
          }
        },
        "service": {
          "port": 3389,
          "proto": 6,
          "process_name": "svchost.exe",
          "windows_service_name": "TermService",
          "user_name": "NETWORK SERVICE"
        },
        "num_connections": 7,
        "state": "active",
        "timestamp_range": {
          "first_detected": "2022-02-03T22:34:04Z",
          "last_detected": "2022-02-03T22:34:04Z"
        },
        "dst_bi": 0,
        "dst_bo": 0,
        "policy_decision": "potentially_blocked",
        "flow_direction": "inbound"
      },
      {
        "src": {
          "ip": "193.56.146.208",
          "ip_lists": [
            {
              "href": "/orgs/28/sec_policy/draft/ip_lists/2191",
              "name": "Internet"
            }
          ]
        },
        "dst": {
          "ip": "10.1.100.149",
          "workload": {
            "href": "/orgs/28/workloads/7c78ab4b-ced8-43a7-bf1f-5e92f89138bf",
            "hostname": "windows-jumpbox-1",
            "os_type": "windows",
            "labels": [
              {
                "href": "/orgs/28/labels/21494",
                "key": "app",
                "value": "Administration"
              },
              {
                "href": "/orgs/28/labels/21480",
                "key": "env",
                "value": "Production"
              },
              {
                "href": "/orgs/28/labels/21481",
                "key": "loc",
                "value": "Dallas"
              },
              {
                "href": "/orgs/28/labels/21495",
                "key": "role",
                "value": "Jump Server"
              }
            ]
          }
        },
        "service": {
          "port": 3389,
          "proto": 6,
          "process_name": "svchost.exe",
          "windows_service_name": "TermService",
          "user_name": "NETWORK SERVICE"
        },
        "num_connections": 23,
        "state": "timed out",
        "timestamp_range": {
          "first_detected": "2022-02-03T22:34:25Z",
          "last_detected": "2022-02-03T22:34:25Z"
        },
        "dst_bi": 0,
        "dst_bo": 0,
        "policy_decision": "potentially_blocked",
        "flow_direction": "inbound"
      },
      {
        "src": {
          "ip": "34.222.179.17",
          "ip_lists": [
            {
              "href": "/orgs/28/sec_policy/draft/ip_lists/2191",
              "name": "Internet"
            }
          ]
        },
        "dst": {
          "ip": "10.1.100.149",
          "workload": {
            "href": "/orgs/28/workloads/7c78ab4b-ced8-43a7-bf1f-5e92f89138bf",
            "hostname": "windows-jumpbox-1",
            "os_type": "windows",
            "labels": [
              {
                "href": "/orgs/28/labels/21494",
                "key": "app",
                "value": "Administration"
              },
              {
                "href": "/orgs/28/labels/21480",
                "key": "env",
                "value": "Production"
              },
              {
                "href": "/orgs/28/labels/21481",
                "key": "loc",
                "value": "Dallas"
              },
              {
                "href": "/orgs/28/labels/21495",
                "key": "role",
                "value": "Jump Server"
              }
            ]
          }
        },
        "service": {
          "port": 3389,
          "proto": 6,
          "process_name": "svchost.exe",
          "windows_service_name": "TermService",
          "user_name": "NETWORK SERVICE"
        },
        "num_connections": 1,
        "state": "timed out",
        "timestamp_range": {
          "first_detected": "2022-02-03T22:33:55Z",
          "last_detected": "2022-02-03T22:33:55Z"
        },
        "dst_bi": 0,
        "dst_bo": 0,
        "policy_decision": "potentially_blocked",
        "flow_direction": "inbound"
      },
      {
        "src": {
          "ip": "20.112.109.175",
          "ip_lists": [
            {
              "href": "/orgs/28/sec_policy/draft/ip_lists/2191",
              "name": "Internet"
            }
          ]
        },
        "dst": {
          "ip": "10.1.100.149",
          "workload": {
            "href": "/orgs/28/workloads/7c78ab4b-ced8-43a7-bf1f-5e92f89138bf",
            "hostname": "windows-jumpbox-1",
            "os_type": "windows",
            "labels": [
              {
                "href": "/orgs/28/labels/21494",
                "key": "app",
                "value": "Administration"
              },
              {
                "href": "/orgs/28/labels/21480",
                "key": "env",
                "value": "Production"
              },
              {
                "href": "/orgs/28/labels/21481",
                "key": "loc",
                "value": "Dallas"
              },
              {
                "href": "/orgs/28/labels/21495",
                "key": "role",
                "value": "Jump Server"
              }
            ]
          }
        },
        "service": {
          "port": 3389,
          "proto": 6,
          "process_name": "svchost.exe",
          "windows_service_name": "TermService",
          "user_name": "NETWORK SERVICE"
        },
        "num_connections": 1,
        "state": "timed out",
        "timestamp_range": {
          "first_detected": "2022-02-03T22:33:50Z",
          "last_detected": "2022-02-03T22:33:50Z"
        },